{
  "schema_version": "obs.trigger_policy.v1",
  "policy_id": "default-symptom-trigger-policy",
  "policy_scope": "recorder",
  "rules": [
    {
      "rule_id": "memory_pressure_low_v1",
      "trigger_name": "memory_pressure_low",
      "trigger_kind": "threshold",
      "signal_id": "memory.available_percent",
      "coverage_signal_id": "memory.summary",
      "operator": "<=",
      "threshold": 20.0,
      "delta": null,
      "burst_count": null,
      "burst_window_ms": null,
      "min_coverage_state": "partial",
      "required_signal_state": "covered_or_partial",
      "cooldown_ms": 30000,
      "hysteresis": {
        "clear_below": null,
        "min_clear_duration_ms": 0
      },
      "freeze_profile": "default_pre_window",
      "root_cause_claim": false,
      "data_quality": {
        "dropped": false,
        "drop_count": 0,
        "throttled": false,
        "missing": [],
        "truncated": false,
        "clock_confidence": "medium",
        "notes": []
      }
    }
  ],
  "default_decision": "evaluate",
  "data_quality": {
    "dropped": false,
    "drop_count": 0,
    "throttled": false,
    "missing": [],
    "truncated": false,
    "clock_confidence": "medium",
    "notes": []
  }
}
